{
  "$schema": "http://json-schema.org/draft-07/schema#",
  "$id": "https://forklore.org/maintainer.schema.json",
  "title": "Maintainer",
  "description": "Schema for validating maintainer JSON files",
  "type": "object",
  "required": ["username", "full_name", "photo", "socials", "projects", "form"],
  "additionalProperties": false,
  "properties": {
    "username": {
      "type": "string",
      "description": "Unique identifier for the maintainer",
      "minLength": 1
    },
    "full_name": {
      "type": "string",
      "description": "Full name of the maintainer",
      "minLength": 1
    },
    "photo": {
      "type": "string",
      "description": "URL to the maintainer's photo",
      "format": "uri"
    },
    "designation": {
      "type": "string",
      "description": "Job title or role description"
    },
    "socials": {
      "type": "array",
      "description": "List of social media links",
      "items": {
        "type": "object",
        "required": ["label", "link"],
        "additionalProperties": false,
        "properties": {
          "label": {
            "type": "string",
            "description": "Social media platform name",
            "enum": [
              "GitHub",
              "GitLab",
              "Gitlab",
              "Codeberg",
              "BitBucket",
              "LinkedIn",
              "X",
              "Twitter",
              "Mastodon",
              "Bluesky",
              "BlueSky",
              "Substack",
              "Discourse",
              "Email",
              "RSS",
              "Web"
            ]
          },
          "link": {
            "type": "string",
            "description": "URL to the social media profile",
            "format": "uri"
          }
        }
      }
    },
    "projects": {
      "type": "array",
      "description": "List of projects maintained",
      "items": {
        "type": "object",
        "required": ["name", "project_link", "description", "short_description"],
        "additionalProperties": false,
        "properties": {
          "name": {
            "type": "string",
            "description": "Name of the project",
            "minLength": 1
          },
          "project_link": {
            "type": "string",
            "description": "URL to the project repository",
            "format": "uri"
          },
          "website_link": {
            "type": "string",
            "description": "URL to the project website",
            "format": "uri"
          },
          "logo": {
            "type": "string",
            "description": "URL to the project logo",
            "format": "uri"
          },
          "description": {
            "type": "string",
            "description": "Full description of the project"
          },
          "short_description": {
            "type": "string",
            "description": "Short description used in cards and meta"
          }
        }
      }
    },
    "form": {
      "type": "array",
      "description": "Q&A form responses",
      "items": {
        "type": "object",
        "required": ["question", "response"],
        "additionalProperties": false,
        "properties": {
          "question": {
            "type": "string",
            "description": "The question text"
          },
          "response": {
            "type": "string",
            "description": "The maintainer's response"
          }
        }
      }
    },
    "created_on": {
      "type": "string",
      "description": "ISO 8601 timestamp of when the entry was created",
      "format": "date-time"
    }
  }
}
