{
  "username": "bupd",
  "full_name": "Prasanth Baskar",
  "photo": "https://avatars.githubusercontent.com/u/89722848?v=4",
  "designation": "Software Engineer at 8gears",
  "socials": [
    {
      "label": "GitHub",
      "link": "https://github.com/bupd"
    },
    {
      "label": "Mastodon",
      "link": "https://mastodon.social/@bupd"
    },
    {
      "label": "LinkedIn",
      "link": "https://www.linkedin.com/in/bupd"
    }
  ],
  "projects": [
    {
      "name": "Harbor",
      "project_link": "https://github.com/goharbor/harbor",
      "website_link": "https://goharbor.io",
      "logo": "https://raw.githubusercontent.com/cncf/artwork/refs/heads/main/projects/harbor/icon/color/harbor-icon-color.png",
      "description": "Harbor is an open source registry that secures artifacts with policies and role-based access control, ensures images are scanned and free from vulnerabilities, and signs images as trusted. Harbor, a CNCF Graduated project, delivers compliance, performance, and interoperability to help you consistently and securely manage artifacts across cloud native compute platforms like Kubernetes and Docker.",
      "short_description": "An open source trusted cloud native registry project that stores, signs, and scans content."
    }
  ],
  "form": [
    {
      "question": "How to support",
      "response": "Star the github repo. Start using Harbor."
    },
    {
      "question": "A small brief about your project",
      "response": "Harbor is basically a parking lot for your container images but with guards, scanners, and a bouncer that won’t let shady images in."
    },
    {
      "question": "One FOSS maintainer lesson for your younger self",
      "response": "do things in parallel and touch grass more."
    },
    {
      "question": "Why do you do it? Why do you bother maintaining a FOSS project?",
      "response": "Apparently, sleep is optional and free stress testing of my patience."
    },
    {
      "question": "If your repo had a theme song, what would it be?",
      "response": "Sangeetha swarangal eley kanaka comedy meme 🐌"
    },
    {
      "question": "Which file in your project would you most like to set on fire?",
      "response": "Entire /tests directory"
    },
    {
      "question": "What's your open-source villain origin story?",
      "response": "YAML broke again? Opened Harbor to “just check an issue”… accidentally became the guy people tag for replication bugs. 😅"
    },
    {
      "question": "If you had to use one emoji to convey what it's like to be a FOSS maintainer, what would it be?",
      "response": "🐢"
    }
  ]
}
