{
  "username": "dalmia",
  "full_name": "Aman Dalmia",
  "photo": "/images/dalmia_photo.png",
  "designation": "Maintainer, Calibrate @ ARTPARK",
  "socials": [
    {
      "label": "GitHub",
      "link": "https://github.com/dalmia"
    },
    {
      "label": "LinkedIn",
      "link": "https://www.linkedin.com/in/dalmiaaman"
    },
    {
      "label": "Web",
      "link": "https://dalmia.github.io"
    }
  ],
  "projects": [
    {
      "name": "Calibrate",
      "project_link": "https://github.com/ARTPARK-SAHAI-ORG/calibrate",
      "website_link": "https://calibrate.artpark.ai",
      "logo": "",
      "short_description": "An AI agent evaluation platform that helps non-profits test their entire agent stack",
      "description": "Calibrate is a CLI and platform for evaluating AI agents, built for non-profits. It moves teams from slow, manual testing to a fast, automated, and repeatable process across the whole agent stack — LLM text-to-text quality and tool-calling, human-aligned LLM judges, speech-to-text and text-to-speech benchmarking across 10+ Indic languages, and realistic persona-driven simulations to surface failure modes. It is built on top of pipecat."
    }
  ],
  "form": [
    {
      "question": "How to support",
      "response": "Star and contribute on GitHub: https://github.com/ARTPARK-SAHAI-ORG/calibrate — try it on your own agent stack, file issues, and help expand language and provider coverage."
    },
    {
      "question": "A small brief about your project",
      "response": "Calibrate is an open-source AI agent evaluation platform for non-profits. It benchmarks LLMs, STT, and TTS providers, builds human-aligned LLM judges, and runs realistic conversation simulations so teams can ship reliable voice and text agents — with first-class support for Indic languages."
    },
    {
      "question": "One FOSS maintainer lesson for your younger self",
      "response": "Ship early and let real users shape the roadmap. The feedback from someone actually depending on your tool is worth more than weeks of polishing in private."
    },
    {
      "question": "Why do you do it? Why do you bother maintaining a FOSS project?",
      "response": "Building evaluation infrastructure in the open means non-profits with limited budgets can ship trustworthy AI for the communities they serve. Maintaining it openly is how that impact compounds beyond any single team."
    },
    {
      "question": "If your repo had a theme song, what would it be?",
      "response": "Eye of the Tiger by Survivor"
    },
    {
      "question": "Which file in your project would you most like to set on fire?",
      "response": "The provider config glue code — every new STT/TTS integration leaves its fingerprints there."
    },
    {
      "question": "What's your open-source villain origin story?",
      "response": "I kept re-running the same brittle, manual agent tests by hand and rage-built an automated evaluator so I'd never have to do it again."
    },
    {
      "question": "If you had to use one emoji to convey what it is like to be a FOSS maintainer, what would it be?",
      "response": "🔥"
    }
  ],
  "created_on": "2026-05-30T12:58:33.646508+05:30"
}