{
  "username": "kdqed",
  "full_name": "Karthik Devan",
  "photo": "https://kdqed.com/assets/brand/dp.jpg",
  "designation": "Self Employed Engineer",
  "socials": [
    {
      "label": "GitHub",
      "link": "https://github.com/kdqed"
    },
    {
      "label": "LinkedIn",
      "link": "https://linkedin.com/in/kdqed"
    },
    {
      "label": "X",
      "link": "https://x.com/kdqed"
    }
  ],
  "projects": [
    {
      "name": "Zaturn",
      "project_link": "https://github.com/kdqed/zaturn",
      "website_link": "https://zaturn.pro",
      "logo": "https://zaturn.pro/assets/logo.png",
      "description": "Zaturn provides tools that enable AI models to run SQL, so you don't have to. It can be used as an MCP or as a web interface similar to Jupyter Notebook. It can connect to multiple types of data sources and also make visualizations, all through chat.",
      "short_description": "Open source, AI-powered data analysis co-pilot"
    }
  ],
  "form": [
    {
      "question": "How to support",
      "response": "Use it, give feedback, donate and advocate"
    },
    {
      "question": "A small brief about your project",
      "response": "Open Source data analysis with VIBES for everyone."
    },
    {
      "question": "One FOSS maintainer lesson for your younger self",
      "response": "Keep building, keep talking about it."
    },
    {
      "question": "Why do you do it? Why do you bother maintaining a FOSS project?",
      "response": "It's fun and I get to do it the way I'd like to."
    },
    {
      "question": "If your repo had a theme song, what would it be?",
      "response": "<a href=\"https://open.spotify.com/track/60a0Rd6pjrkxjPbaKzXjfq\">https://open.spotify.com/track/60a0Rd6pjrkxjPbaKzXjfq</a>"
    },
    {
      "question": "Which file in your project would you most like to set on fire?",
      "response": "<a href=\"https://github.com/kdqed/zaturn/blob/main/zaturn/studio/storage.py\">https://github.com/kdqed/zaturn/blob/main/zaturn/studio/storage.py</a>"
    },
    {
      "question": "What's your open-source villain origin story?",
      "response": "It's 2025, and it feels weird to be writing SQL for simple questions about my data."
    },
    {
      "question": "If you had to use one emoji to convey what it's like to be a FOSS maintainer, what would it be?",
      "response": "💀 (I think my least favorite parts of being a FOSS maintainer are dealing with emojis and Discord)"
    }
  ]
}