{
  "username": "shikhamis11",
  "full_name": "Shikha Mishra",
  "photo": "https://avatars.githubusercontent.com/u/25526037",
  "designation": "Community Contributor & Maintainer, Magento",
  "socials": [
    {
      "label": "GitHub",
      "link": "https://github.com/shikhamis11"
    },
    {
      "label": "LinkedIn",
      "link": "https://www.linkedin.com/in/shikhamishra03/"
    },
    {
      "label": "Web",
      "link": "https://github.com/readme/shikha-mishra"
    }
  ],
  "projects": [
    {
      "name": "Magento Open Source",
      "project_link": "https://github.com/magento/magento2",
      "website_link": "https://developer.adobe.com/open/magento",
      "logo": "https://avatars.githubusercontent.com/u/168457?s=48&v=4",
      "description": "Magento is an open-source e-commerce platform written in PHP. It provides online merchants with a flexible shopping cart system and control over the look, content, and functionality of their online store. Magento offers powerful tools for marketing, search engine optimization, and catalog management. It is widely used by businesses of all sizes to create scalable and customizable online stores.",
      "short_description": "Magento is a PHP-based e-commerce platform for building and managing online stores."
    }
  ],
  "form": [
    {
      "question": "How to support",
      "response": "You can support Magento 2 Open Source by contributing to its code on GitHub, reporting issues, and helping others in community forums. Creating and sharing custom modules, writing tutorials, improving documentation, and participating in events like Meet Magento also help grow and strengthen the Magento ecosystem."
    },
    {
      "question": "A small brief about your project",
      "response": "Magento 2 is an open-source e-commerce platform that allows businesses to build and manage online stores. It offers flexible customization, powerful features, and supports scalable, secure shopping experiences."
    },
    {
      "question": "One FOSS maintainer lesson for your younger self",
      "response": "Automate everything you can."
    },
    {
      "question": "Why do you do it? Why do you bother maintaining a FOSS project?",
      "response": "I started out of curiosity—to learn, challenge myself, and build something useful. Over time, it became more than code. It’s about solving real problems, seeing others use it, and growing with the community."
    },
    {
      "question": "If your repo had a theme song, what would it be?",
      "response": "It would be Magento Life | Tech Song Projekt — it captures the highs, lows, and caffeine-fueled chaos of maintaining a Magento project. Absolute vibe."
    },
    {
      "question": "Which file in your project would you most like to set on fire?",
      "response": "di.xml — without hesitation. It’s powerful, but one wrong move and suddenly nothing resolves, the cache gaslights you, and you're knee-deep in stack traces trying to figure out why your class won’t inject."
    },
    {
      "question": "What's your open-source villain origin story?",
      "response": "My open-source villain origin story? My PRs sat untouched for weeks—not because they were bad, but because the maintainer queue was overloaded. So I stopped waiting... and applied to become a maintainer myself. If you can’t speed it up from the outside, do it from the inside."
    },
    {
      "question": "If you had to use one emoji to convey what it is like to be a FOSS maintainer, what would it be?",
      "response": "😍 — because despite the bugs, the burnout, and the chaos... I still love it."
    }
  ]
}
